{
	"$schema": "./schema.json",
	"format": "gg:challenge/1",
	"title": "Your first challenge",
	"description": "Nothing is sending the app traffic, and its code fails on every request. Wire it up, fix one line, and watch a run score itself.",
	"suggests": [],
	"instructions": [
		"Every challenge works the same way: get the canvas ready, press Run, and the goals score what happens while a script drives the traffic. This one walks you through it.",
		"Drag a connection from Traffic to Web App, then press Run. Every request will fail, and that is the bug you are here to fix.",
		"Once the run starts, select Web App and open its Logs tab to see the error. Fix the line it names, then run again."
	],
	"length": 30,
	"events": [
		{
			"at": 8,
			"text": "Traffic doubles to twenty requests a second",
			"set": {
				"node": { "name": "Traffic" },
				"config": { "requestsPerSecond": 20 }
			}
		}
	],
	"fixed": [{ "node": { "name": "Traffic" } }, { "node": { "name": "Web App" } }],
	"goals": [
		{
			"id": "wired",
			"title": "Traffic is connected to Web App",
			"conditions": [{ "edge": { "from": { "name": "Traffic" }, "to": { "name": "Web App" } } }]
		},
		{
			"id": "answered",
			"title": "Web App answers every request without an error",
			"hint": "The error in Web App's logs names the line in server.js that every request is dying on.",
			"conditions": [
				{
					"metric": {
						"node": { "name": "Traffic" },
						"metricName": "errors",
						"statistic": "Average",
						"from": 5,
						"lte": 0
					}
				}
			]
		}
	],
	"startingCanvas": {
		"format": "gg:project/1",
		"nodes": [
			{
				"id": "traffic",
				"type": "requestGenerator",
				"position": { "x": -260, "y": 0 },
				"config": { "name": "Traffic", "requestsPerSecond": 10 },
				"chart": "errors"
			},
			{
				"id": "app",
				"type": "instanceGroup",
				"position": { "x": 40, "y": 0 },
				"config": { "name": "Web App", "instanceCount": 1 }
			}
		],
		"edges": [],
		"nodeFiles": {
			"app": {
				"package.json": "{\n  \"name\": \"instance-group\",\n  \"type\": \"module\",\n  \"dependencies\": {\n    \"express\": \"^5.1.0\"\n  },\n  \"scripts\": {\n    \"start\": \"node server.js\"\n  }\n}\n",
				"server.js": "import express from 'express';\n\n// Glass Garden gives every instance its own PORT, because they all share one machine here.\n// In a real deployment they would each be on their own machine, and could all listen on the same port.\nconst port = Number(process.env.PORT);\nif (!port) {\n  throw new Error('PORT is not set');\n}\n\nconst app = express();\n\napp.get('/', (req, res) => {\n  // One name on the line below is not the one this file declares, so every request ends in a\n  // 500 instead of an answer. The Logs tab has the error and the line it came from, and the\n  // generator's Metrics tab has the failures it is counting\n  res.type('text/plain').send(`Hello from the instance on :${instancePort}\\n`);\n});\n\napp.listen(port, () => {\n  console.log(`Server running on http://localhost:${port}`);\n});\n"
			}
		}
	}
}
